{
  "schema_version": "1.0.0",
  "template_id": "FIN-IOU-001",
  "name": "Acknowledgement Of Debt (Iou)",
  "category": "IOUs",
  "intended_use": "Evidence of an existing debt; use a promissory note where a formal payment promise or negotiable instrument is intended.",
  "source": {
    "document": "ClauseCite_Financial_Agreement_Template_Library.docx",
    "source_format": "docx",
    "extraction_mode": "ordered_text_and_tables",
    "fidelity_note": "Clause wording is retained from the supplied source; review extraction and formatting before production use."
  },
  "key_variables": [
    "amount",
    "debt basis",
    "due date",
    "payment method"
  ],
  "inputs": [
    {
      "key": "",
      "source_placeholder": "...",
      "type": "string",
      "required": null,
      "description": "Confirm with the user; do not infer or invent.",
      "value": null
    },
    {
      "key": "acknowledgement_date",
      "source_placeholder": "ACKNOWLEDGEMENT_DATE",
      "type": "string",
      "required": null,
      "description": "Confirm with the user; do not infer or invent.",
      "value": null
    },
    {
      "key": "act_or_regulation",
      "source_placeholder": "ACT_OR_REGULATION",
      "type": "string",
      "required": null,
      "description": "Confirm with the user; do not infer or invent.",
      "value": null
    },
    {
      "key": "admitted_in_full_subject_to_the_reconciliation_in_schedule_a",
      "source_placeholder": "ADMITTED_IN_FULL / SUBJECT_TO_THE_RECONCILIATION_IN_SCHEDULE_A",
      "type": "string",
      "required": null,
      "description": "Confirm with the user; do not infer or invent.",
      "value": null
    },
    {
      "key": "amount",
      "source_placeholder": "AMOUNT",
      "type": "decimal_or_string",
      "required": null,
      "description": "Confirm with the user; do not infer or invent.",
      "value": null
    },
    {
      "key": "basis_of_debt",
      "source_placeholder": "BASIS_OF_DEBT",
      "type": "string",
      "required": null,
      "description": "Confirm with the user; do not infer or invent.",
      "value": null
    },
    {
      "key": "bear_not_bear",
      "source_placeholder": "BEAR / NOT BEAR",
      "type": "string",
      "required": null,
      "description": "Confirm with the user; do not infer or invent.",
      "value": null
    },
    {
      "key": "court_or_arbitration_venue",
      "source_placeholder": "COURT_OR_ARBITRATION_VENUE",
      "type": "string",
      "required": null,
      "description": "Confirm with the user; do not infer or invent.",
      "value": null
    },
    {
      "key": "currency",
      "source_placeholder": "CURRENCY",
      "type": "string",
      "required": null,
      "description": "Confirm with the user; do not infer or invent.",
      "value": null
    },
    {
      "key": "date_or_schedule",
      "source_placeholder": "DATE_OR_SCHEDULE",
      "type": "string",
      "required": null,
      "description": "Confirm with the user; do not infer or invent.",
      "value": null
    },
    {
      "key": "days",
      "source_placeholder": "DAYS",
      "type": "string",
      "required": null,
      "description": "Confirm with the user; do not infer or invent.",
      "value": null
    },
    {
      "key": "debt_amount",
      "source_placeholder": "DEBT_AMOUNT",
      "type": "decimal_or_string",
      "required": null,
      "description": "Confirm with the user; do not infer or invent.",
      "value": null
    },
    {
      "key": "details",
      "source_placeholder": "DETAILS",
      "type": "string",
      "required": null,
      "description": "Confirm with the user; do not infer or invent.",
      "value": null
    },
    {
      "key": "details_or_none",
      "source_placeholder": "DETAILS_OR_NONE",
      "type": "string",
      "required": null,
      "description": "Confirm with the user; do not infer or invent.",
      "value": null
    },
    {
      "key": "due_date",
      "source_placeholder": "DUE_DATE",
      "type": "string",
      "required": null,
      "description": "Confirm with the user; do not infer or invent.",
      "value": null
    },
    {
      "key": "effective_date",
      "source_placeholder": "EFFECTIVE_DATE",
      "type": "string",
      "required": null,
      "description": "Confirm with the user; do not infer or invent.",
      "value": null
    },
    {
      "key": "entity_type",
      "source_placeholder": "ENTITY_TYPE",
      "type": "string",
      "required": null,
      "description": "Confirm with the user; do not infer or invent.",
      "value": null
    },
    {
      "key": "governing_jurisdiction",
      "source_placeholder": "GOVERNING_JURISDICTION",
      "type": "string",
      "required": null,
      "description": "Confirm with the user; do not infer or invent.",
      "value": null
    },
    {
      "key": "jurisdiction",
      "source_placeholder": "JURISDICTION",
      "type": "string",
      "required": null,
      "description": "Confirm with the user; do not infer or invent.",
      "value": null
    },
    {
      "key": "notice_email",
      "source_placeholder": "NOTICE_EMAIL",
      "type": "string",
      "required": null,
      "description": "Confirm with the user; do not infer or invent.",
      "value": null
    },
    {
      "key": "party_a_legal_name",
      "source_placeholder": "PARTY_A_LEGAL_NAME",
      "type": "string",
      "required": null,
      "description": "Confirm with the user; do not infer or invent.",
      "value": null
    },
    {
      "key": "party_b_legal_name",
      "source_placeholder": "PARTY_B_LEGAL_NAME",
      "type": "string",
      "required": null,
      "description": "Confirm with the user; do not infer or invent.",
      "value": null
    },
    {
      "key": "payment_method",
      "source_placeholder": "PAYMENT_METHOD",
      "type": "string",
      "required": null,
      "description": "Confirm with the user; do not infer or invent.",
      "value": null
    },
    {
      "key": "rate",
      "source_placeholder": "RATE",
      "type": "decimal_or_string",
      "required": null,
      "description": "Confirm with the user; do not infer or invent.",
      "value": null
    },
    {
      "key": "registered_address",
      "source_placeholder": "REGISTERED_ADDRESS",
      "type": "string",
      "required": null,
      "description": "Confirm with the user; do not infer or invent.",
      "value": null
    },
    {
      "key": "registration_number",
      "source_placeholder": "REGISTRATION_NUMBER",
      "type": "string",
      "required": null,
      "description": "Confirm with the user; do not infer or invent.",
      "value": null
    },
    {
      "key": "retrieval_timestamp",
      "source_placeholder": "RETRIEVAL_TIMESTAMP",
      "type": "string",
      "required": null,
      "description": "Confirm with the user; do not infer or invent.",
      "value": null
    },
    {
      "key": "section_or_rule",
      "source_placeholder": "SECTION_OR_RULE",
      "type": "string",
      "required": null,
      "description": "Confirm with the user; do not infer or invent.",
      "value": null
    },
    {
      "key": "signatory_name",
      "source_placeholder": "SIGNATORY_NAME",
      "type": "string",
      "required": null,
      "description": "Confirm with the user; do not infer or invent.",
      "value": null
    },
    {
      "key": "signatory_title",
      "source_placeholder": "SIGNATORY_TITLE",
      "type": "string",
      "required": null,
      "description": "Confirm with the user; do not infer or invent.",
      "value": null
    },
    {
      "key": "signature_date",
      "source_placeholder": "SIGNATURE_DATE",
      "type": "string",
      "required": null,
      "description": "Confirm with the user; do not infer or invent.",
      "value": null
    },
    {
      "key": "source_uri",
      "source_placeholder": "SOURCE_URI",
      "type": "string",
      "required": null,
      "description": "Confirm with the user; do not infer or invent.",
      "value": null
    },
    {
      "key": "start_date",
      "source_placeholder": "START_DATE",
      "type": "string",
      "required": null,
      "description": "Confirm with the user; do not infer or invent.",
      "value": null
    },
    {
      "key": "version_or_effective_date",
      "source_placeholder": "VERSION_OR_EFFECTIVE_DATE",
      "type": "string",
      "required": null,
      "description": "Confirm with the user; do not infer or invent.",
      "value": null
    },
    {
      "key": "witness_date",
      "source_placeholder": "WITNESS_DATE",
      "type": "string",
      "required": null,
      "description": "Confirm with the user; do not infer or invent.",
      "value": null
    },
    {
      "key": "witness_name",
      "source_placeholder": "WITNESS_NAME",
      "type": "string",
      "required": null,
      "description": "Confirm with the user; do not infer or invent.",
      "value": null
    }
  ],
  "document_structure": [
    {
      "type": "table",
      "content": "Template ID | FIN-IOU-001\nCategory | Promissory notes & IOUs\nIntended use | Evidence of an existing debt; use a promissory note where a formal payment promise or negotiable instrument is intended."
    },
    {
      "type": "table",
      "content": "DRAFTING PLACEHOLDERS: Replace every {{...}} field, delete unused options, complete all schedules, and resolve all [SELECT]/[OPTIONAL] text before signature. Text in square brackets is an instruction, not an agreed term."
    },
    {
      "type": "text",
      "content": "This ACKNOWLEDGEMENT OF DEBT (IOU) (the “Agreement”) is made on {EFFECTIVE_DATE} (the “Effective Date”) by and between {{PARTY_A_LEGAL_NAME}} and {{PARTY_B_LEGAL_NAME}}."
    },
    {
      "type": "text",